lesson,vi,en
28,"Không chỉ chuyện này đâu. Từ giờ trở đi, nếu thấy có gì chưa chắc chắn, em phải xác nhận.","Not just this. From now on, if you see anything uncertain, you must confirm."
28,"Dạ, em hiểu rồi. Để em xác nhận lại với team DB và team BA.","Yes, I understand. Let me confirm with the DB team and BA team."
29,"Long, em không làm unit testing à? Anh không thấy lỗi unit testing của em trên Jira.","Long, you didn't do unit testing? I cannot see your unit testing defects on Jira"
29,"Em không biết là mình phải làm unit testing.","I don't know that I have to do unit testing"
29,"Khoan đã, chẳng phải em đã học ở đại học rằng sau khi code phải làm unit testing sao?","Wait, didn't you learn in university that we have to do unit testing after coding?"
29,"Ồ, em có nghe thầy cô nói, nhưng họ chỉ nói sơ qua. Em tưởng nó không quan trọng nên không chú ý.","Oh, I heard my teachers say it, but they just said it briefly. I thought it wasn't important so I didn't pay attention"
29,"Anh nhớ trong môn kiểm thử phần mềm có dạy unit testing rất kỹ. Có lẽ em chưa học kỹ rồi. Giờ em làm unit testing cho module của mình trước khi gửi sản phẩm sang tester kiểm thử nhé.","I remember the software testing course taught unit testing thoroughly. You probably didn't study it carefully. Now you do unit testing for your module before sending the product to the testers for testing."
29,"Dạ vâng. À, cho em hỏi, em không thấy có task unit testing trong lịch trình. Vậy thời gian unit testing được phân bổ ở đâu ạ?","Yes sir, oh, let me ask you, I don't see the unit testing task in the schedule. So where is the unit testing time allocated?"
29,"Dạ, em hiểu rồi. Em sẽ làm unit testing ngay bây giờ.","Yes, I understand. I will do unit testing now."
30,"Chị Thanh ơi, lúc nãy anh Tuấn bảo em làm unit testing. Thật ra em có học ở đại học nhưng giờ không nhớ gì cả. Em sợ anh Tuấn la nên không dám hỏi.","Ms.Thanh, earlier Mr.Tuan ask me to do unit testing. To be honest, I learned it at university but I don't remember anything. I was afraid Mr. Twan would scold me so I didn't dare ask him."
30,"Chị là tester nên chắc chị biết chuyện này, chị có thể chỉ em cách làm unit testing không?","You are a tester so you must know about this, can you tell me how to do unit testing?"
30,"Mặc dù chị là tester, nhưng chị chỉ biết lý thuyết về unit testing thôi, vì chị không phải developer. Em nên hỏi anh Tâm hoặc anh Trung.","Even though I am a tester, I only know the theory about unit testing, because I am not a developer. You should ask Mr.Tam or Mr.Trung"
30,"Unit testing có hai phương pháp: white box testing và black box testing. Em nên ôn lại lý thuyết của hai cái này trên mạng. Nếu chị nói hết bây giờ thì sẽ tốn nhiều thời gian.","Unit testing includes two methods: white box testing and black box testing. You should review the theory of these two online. If I tell you now, it will take a lot of time."
30,"Công ty mình áp dụng cả white box testing lẫn black box testing. Em chỉ cần học lại rồi có gì không hiểu thì hỏi chị.","Our company does both white box testing and black box testing. Just learn about it and ask me if you don't understand anything."
30,"Nếu bây giờ em đọc lại lý thuyết thì em không biết phải đọc ở đâu và bắt đầu như thế nào. Có cách nào nhanh hơn không?","Now if I read the theory again, I don't know where to read and how to start reading again. Is there a faster way?"
30,"Ồ, em nên hỏi ChatGPT. AI sẽ xử lý được mấy cái kiến thức cơ bản này.","Oh you should ask chat GPT. These should be okay with AI, because it's basic knowledge."
31,"Anh Tâm ơi, cho em hỏi về unit testing.","Mr. Tam, let me ask you about unit testing."
31,"Em có hai câu hỏi muốn hỏi anh.","I have two questions for you."
31,"Câu hỏi thứ nhất là, em thấy trên mạng người ta nói unit testing chỉ làm white box testing chứ không làm black box testing. Vậy tại sao công ty mình lại làm cả black box testing nữa?","The first question is, I see on the internet that people say unit testing only does white box testing, not black box testing. So why does our company also do black box testing?"
31,"Công ty mình thường làm white box testing. Nhưng trong lý thuyết kiểm thử phần mềm, nêu rõ unit testing bao gồm cả white box và black box.","We often do white box testing. But in software testing theory, it is clear that unit testing includes both white box and black box."
31,"White box chỉ đảm bảo các hàm em viết trong code không bị lỗi, không có code dư thừa hay vòng lặp vô tận.","White box only ensures that the functions you write in the code are error free and do not have redundant code, or do not have infinite loops."
31,"Còn để đảm bảo màn hình em tạo ra không bị lỗi giao diện và các chức năng hoạt động đúng, thì em phải làm thêm black box testing. Công ty mình yêu cầu cả hai cái đó là hợp lý.","To ensure that the screen you create has no interface errors and the functions actually work properly, you must also do black box testing. My company requires both of those, which is reasonable."
31,"Vâng, em hiểu rồi. Câu hỏi thứ hai là, khi viết test case cho white box testing, thì mình phải đảm bảo test case bao phủ tất cả đường đi của code (tức C3) như trong lý thuyết đúng không ạ?","Yes. I understand. And the second question is, when writing white box testing test cases, we will ensure that the test cases will cover all code paths (i.e C3) as in theory, right?"
31,"Không, thực tế thì em chỉ cần bao phủ tất cả các nhánh, tức là C2, như vậy là đủ. C3 sẽ tốn rất nhiều thời gian và công sức.","No, actually you just need to cover all the branches, I.e C2, and that's enough, i.e C3 will take a lot of time and effort."
31,"À, em hiểu rồi. Cảm ơn anh nhiều.","Oh, I see. Thanks a lot."
32,"Tại sao công ty mình yêu cầu chụp ảnh bằng chứng khi test màn hình, nhưng công ty bạn mình thì không?","Why do I see that our company requires taking test evidence photos when testing screens, but I don't see any of my friends companies doing this?"
32,"Đúng vậy, các công ty outsourcing cho khách hàng Nhật thường làm vậy. Nhưng các công ty cho khách hàng châu Âu và Mỹ thì không.","Yes, outsourcing companies for Japanese customers usually do this. But companies for European and American customers never do this"
32,"Tôi nghĩ việc chụp bằng chứng để chứng minh màn hình không lỗi là mất thời gian hơn là test. Mình đã làm báo cáo test rồi, chẳng lẽ người Nhật không tin mình sao?","I think taking test evidence to prove that my screen is error-free is a waste of time rather than testing. We've already done the test report, do the Japanese not believe us?"
32,"Đúng rồi, người Nhật rất khắt khe, nhưng chúng ta cũng không đến nỗi nào. Nhiều người không chụp bằng chứng mà dùng phần mềm chỉnh sửa ảnh để làm giả bằng chứng. Nhưng đừng bắt chước họ. Haha.","That's right, the Japanese are very picky and we're not that bad either. Many people don't take test evidence but use image processing software to fake test evidence. But don't imitate them. Haha."
32,"Đúng là người Việt mình đầy mánh khóe.","It's true that Vietnamese people are full of tricks"
33,"Chị Thanh ơi, khi mình log defect thì có phải chọn loại defect không?","Ms Thanh, when we log a defect, do we have to choose what type of defect is"
33,"Đúng rồi, đó là thông tin quan trọng để sau này mình có thể làm báo cáo test chính xác.","Yes, that is important information so that we can make an accurate test report later."
33,"Nhưng em thấy các mục trong list box này khó chọn quá. Em không biết chọn mục nào.","But I find the items in this list box so difficult to choose. I don't know which item to choose."
33,"À, ý em là mấy mục này phải không?","Oh, you mean these items right?"
33,"Đúng rồi đó. Mấy thứ này nhìn thì đơn giản mà khó hiểu hơn cả code.","Yes, that's right. These things look simple but they are more difficult to understand than coding."
33,"Để chị giải thích cho em. Coding convention defects là lỗi liên quan đến việc đặt tên biến, method, class, comment code không đúng theo quy định của dự án. Nghĩa là code của em vẫn chạy đúng nhưng không tuân thủ quy định trình bày code của dự án.","Let me explain. Coding convention defects relate to naming variables, methods, classes, commenting code, that are not in accordance with the project's regulations. That is, your code still runs correctly but does not comply with the project's code presentation regulations."
33,"Coding logic defects là lỗi khi em hiểu business đúng nhưng code sai, dẫn đến kết quả sai.","Coding logic defects are defects where you understand the business correctly but code incorrectly, leading to incorrect results."
33,"Wrong business logic defects là do hiểu sai business, nên kết quả bị sai.","Wrong business logic defects occur because of a misunderstanding business, so the result is wrong."
33,"À, em hiểu rồi. Chị giải thích dễ hiểu thật.","Oh, I see. Your explanation is easy to understand."
34,"Chị Thanh ơi, em kể chị nghe chuyện này.","Ms Thanh, let me tell you something."
34,"Nghe có vẻ thú vị đó, kể chị nghe đi.","Sounds curious, tell me."
34,"Ý em là chị Thảo cũng rất linh hoạt. Có lúc chị ấy chỉ phát hiện defect của em rồi nói chuyện trực tiếp với em, không cần log defect lên Jira.","I mean, Miss Thao is also very flexible. Sometimes she just finds my defects and then chats with me about the content, without needing to log the defect on Jira."
34,"Thật sao? Vậy là chị ấy làm sai rồi, chứ không phải linh hoạt đâu. Nhưng mà chị tưởng tester phải linh hoạt và nên được thăng chức chứ. Haha!","Is that true? So she's doing it wrong, not flexible. But I thought testers were flexible and should be promoted. Haha!"
34,"Nếu em gặp defect mà không log lên Jira thì thống kê defect sau này sẽ không chính xác, ảnh hưởng đến dữ liệu của dự án.","If you encounter a defect and do not log it in Jira, the defect statistics will be inaccurate later, affecting the project's data."
34,"Công ty bạn em làm vậy suốt, sao công ty mình lại phải ghi chép mấy dữ liệu phức tạp này làm gì?","My friends company does it all the time, why does our company have to keep track of these complicated data?"
34,"Nếu mình không làm vậy thì sẽ khó kiểm soát chất lượng của dự án.","If we don't do that, it will be difficult to control the quality of the project."
34,"Đúng là làm cho công ty lớn mệt thật đó. Em nghĩ làm cho công ty nhỏ có khi sướng hơn.","Yes! Working for a big company is tiring, isn't it? I think working for a small company is better."
34,"Cái nào cũng có cái hay và cái dở riêng thôi.","Each has its own good and bad points."
35,"Em đã log các defect của unit testing chưa?","Are you logging unit testing defects?"
35,"Dạ rồi, em đã làm xong unit testing và giờ đang log các defect lên JIRA.","Yes, I've finished the unit testing and now I'm logging the defects to JIRA."
35,"Sao em không log từng defect ngay khi phát hiện, mà đợi đến khi phát hiện hết rồi mới log một lần vậy?","Why don't you log each defect right after catching one, but wait until you catch all of them before logging them all at once?"
35,"Em lười đó. Bắt được hết lỗi rồi log một lần cho tiện.","I'm lazy. After catching all the defects, log them all at once for convenience."
35,"Làm vậy dễ bị sót lỗi lắm. Nên nếu phát hiện lỗi nào thì log ngay lên JIRA luôn nhé.","You can easily miss bugs by doing that. So if you find any bugs log them to JIRA immediately."
35,"Dạ đúng là có lúc em phải ngồi nhớ lại rất lâu mới ghi được hết các lỗi đã phát hiện. Lần sau em sẽ làm như chị nói.","Yes, it is true that sometimes I have to sit for a long time to remember all the defects I have caught. Next time I will do as you said."
36,"Long, mở file unit test case của em ra để chị nói chuyện này.","Long, open your unit test case file so I can tell you this."
36,"Dạ, chị đợi em chút, để em mở nó ra.","Yes, wait for me a moment, let me open it."
36,"Khoan đã, em để file unit test case trên desktop hả?","Wait, did you put your unit test case file on the desktop?"
36,"Dạ đúng rồi, em để vậy cho tiện tìm. Em để tất cả các file quan trọng hoặc đang dùng trên desktop.","Yes, I leave it like that for convenience and ease of finding. I leave all the files I'm using or important on the desktop."
36,"Ôi, em không nên làm vậy đâu. Em nên tạo thư mục ở ổ D hoặc ổ E, tránh ổ C, rồi để tất cả file của em trong đó. Khi em để trong các thư mục như Download, Desktop, My Document, nếu Windows bị lỗi, bộ phận IT sẽ format ổ C và em sẽ mất hết dữ liệu.","Oh, you shouldn't do that. You should create a folder in drive D or E, avoid drive C. Then put all your files in those drives. When you put them in folders like download, desktop, my document, if your windows is damaged, IT will format drive C and you will lose all your data."
36,"Ôi, em chưa từng nghĩ tới chuyện đó. Cảm ơn chị đã nhắc em.","Oh, I hadn't thought of that. Thanks for letting me know."
37,"Long, đọc giúp chị các comment trong code review, sửa lại rồi báo cho chị để chị review lại nhé.","Long, please read my code review comments, fix them and let me know so I can review them again for you."
37,"Dạ, em sẽ làm ngay ạ.","Yes, I'll do it right away."
37,"Em đã sửa xong hết rồi, chị review lại giúp em nhé.","I have fixed everything, please review it for me."
37,"Lại đây nói chị nghe, em học được gì sau lần code review đầu tiên này?","Come here and tell me what you learned from this first code review."
37,"Dạ, đầu tiên là em học được cách code theo coding conventions. Mấy cái này tưởng đơn giản mà em vẫn sai ở nhiều chỗ.","Yes, first of all, I learned how to code according to coding conventions. These are simple things, but I still make the same mistake in many places."
37,"Thứ hai là em chưa biết cách xử lý các lỗi phổ biến như try-catch NullPointerException hay NumberFormatException. Khi biến tham chiếu bị null hoặc dữ liệu đầu vào không hợp lệ, chương trình sẽ bị lỗi và dừng.","Second, I don't know how to trap common errors like try catch null point exception or number format exception. When the reference variable is null or the input data is not a valid number, the program will error and stop."
37,"Thứ ba là có vài chỗ thuật toán của em chưa được tối ưu, cách làm của em vẫn còn rườm rà. Chị chỉ cần nhìn qua là có thể tối ưu ngay. Chị thật sự đỉnh luôn.","Third, there are some places where my algorithm is not optimized yet, and my solution is still cumbersome. You can optimize the algorithm for me right away with just one look. You are truly top notch."
37,"Biết nịnh ghê ha, haha. Lần sau khi code, nếu thấy chỗ nào chưa chắc hoặc chưa tối ưu, em nên hỏi chị hoặc Châu. Đừng bắt đầu làm khi vẫn còn cảm thấy do dự.","You know how to flatter, haha. Next time when coding, if you see something uncertain or not optimized, you should consult me or Chew. Don't start doing something if you still feel hesitant."
38,"Chào mọi người, hôm nay chúng ta sẽ tiến hành buổi sprint review cho sprint vừa rồi. Cuộc họp có sự tham gia của tất cả các thành viên trong dự án. Product Owner sẽ review sản phẩm của mọi người. Nếu ai có thắc mắc gì thì có thể hỏi Product Owner nhé.","Hi everyone, today we will conduct a sprint review for the last sprint. The meeting is attended by all members of the project. The product owner will review everyone's product. If you have any questions, you can ask the product owner."
38,"Chào mọi người. Rất vui được gặp lại. Chúng ta cùng thảo luận thoải mái nhé.","Hello everyone. Nice to see you again. Let's discuss freely."
38,"Long bắt đầu trước đi, vì module của em là đơn giản nhất nên em trình bày trước nhé. Cứ tự tin lên.","Long start first, because your module is the simplest, so you start first. Be confident."
38,"Dạ, em chào mọi người. Đây là lần đầu tiên em làm việc này. Nếu có gì sai sót, mong mọi người góp ý giúp em.","Yes. Hello everyone. This is my first time doing this. If there are any mistakes, please let me know."
38,"Em bắt đầu nhé.","Go ahead."
38,"Dạ, em được giao làm màn hình tạo mới phòng khám. Em làm cả front-end và back-end. Trước tiên, em xin demo phần giao diện.","Yes. I was assigned to create the create new clinic screen. I did both the front end and back end. First, I would like to demo the interface."
38,"Để vào được màn hình này, chúng ta phải click vào 'Clinic' trong menu.","To get to this screen, we have to click on 'Clinic' in the menu."
38,"Chúng ta phải nhập dữ liệu vào các mục A, B, C. Các mục D, E, F là tùy chọn.","We must fill data in items A, B, C. Items D, E, F are optional."
38,"Khoan đã. Mục D cũng là bắt buộc nhé.","Wait for minutes. Item D is also required."
38,"Dạ, để em ghi chú lại và sửa.","Yes. let me note it down and fix it."
38,"Tiếp theo, nếu nhập sai định dạng email, màn hình sẽ hiển thị thông báo lỗi với nội dung như thế này. Em đã trình bày xong phần giao diện, bây giờ em xin trình bày phần code backend.","Next, if we enter the wrong email format, the screen will display an error message with the content. I have finished presenting the interface. Now I will present the backend code."
38,"Em tạo 2 hàm API và đưa dữ liệu vào bảng Clinic như thế này.","I create 2 API functions and put the data into the Clinic table like this."
38,"Ổn rồi đó. Nhớ sửa phần mà David đã comment nhé. Tiếp theo, mời anh Trung.","OK, bro. Remember to fix the part David commented on. Next. MrTrung, please."
39,"Chào mọi người, hôm nay chúng ta sẽ có buổi họp sprint retro cho sprint vừa rồi.","Hello everyone, today we are going to have a sprint retro meeting for the last sprint."
39,"Nếu ai có ý kiến gì thì hãy xung phong phát biểu trước nhé.","If anyone has any ideas, please volunteer to speak first."
39,"Em xin phát biểu trước. Em thấy vấn đề này đã được nêu ra nhiều lần rồi, nhưng đến giờ vẫn chưa cải thiện. Đó là chất lượng unit testing vẫn còn thấp. Vẫn còn nhiều lỗi unit testing mà dev để lọt tới tester.","I have an opinion first. I see this issue has been raised many times, but until now it has not improved. That is the quality of unit testing is still low. There are still many unit testing errors that devs let slip to testers."
39,"Lần trước chúng ta đã thống nhất rằng dev phải làm nhiều api testing hơn trước khi giao cho tester. Việc đó đã được thực hiện chưa nhỉ?","Last time we agreed that dev must do more API testing before handing it over to tester. Has that been done yet?"
39,"Đúng là dev đã làm api testing và phần đó đã cải thiện nhiều rồi. Điều em muốn nói ở đây là vẫn còn nhiều lỗi nhỏ liên quan đến giao diện.","It is true that the dev has done API testing and that part has improved a lot. What I want to say here is that there are still a lot of small errors related to the interface."
39,"Em nghĩ điều này cũng liên quan đến ý thức của các developer. Họ vẫn chủ quan, nghĩ rằng tester kiểu gì cũng sẽ phát hiện ra lỗi, nên vẫn có tư tưởng test qua loa.","I think this is also related to awareness. Developers still subjectively think that testers will somehow catch those errors, so they still have the mindset of testing carelessly."
39,"Em nghĩ một phần là do effort dành cho unit testing còn ít. Em thấy thời gian dành cho coding cộng với unit testing, log bug và fix bug vẫn chưa đủ.","I think it's partly because of the less effort spent on unit testing. I think the time spent on coding plus unit testing plus bug logging plus bug fixing is still not enough."
39,"Vậy thì PM phải thống kê effort thực tế mà team cần để làm unit testing và fix bug.","Then PM must conduct statistics on the actual effort needed for the team to do unit testing and bug fixing."
39,"OK, vậy thì ngay trong biên bản cuộc họp này, giao nhiệm vụ đó cho em luôn nhé.","Okay then right in the meeting minutes that assigned that task to me."
40,"Chị Thúy ơi, PO vừa gửi tài liệu mô tả yêu cầu liên quan đến chức năng của em mà đọc thấy hoa cả mắt, em không biết bắt đầu từ đâu.","Miss Thuy, the PO newly sent requirement description document related to my function makes me dizzy reading it, I don't know where to start."
40,"À, tài liệu này hơi phức tạp một chút. Để chị chỉ cho em cách đọc và đặt câu hỏi về các tài liệu như thế này.","Well, this document is a bit complicated. Let me show you how to read and ask questions about documents like this."
40,"Chờ một chút. Để chị mang cheer ra và ngồi cạnh em. OK, bắt đầu thôi.","Wait for me a moment. Let me bring a chair out and sit next to you. OK, let's get started."
40,"Theo kinh nghiệm của chị, chị thường làm như sau. Mở file tài liệu, đọc từng dòng và highlight nó bằng màu xanh hoặc đỏ. Điều này để đảm bảo em đã đọc dòng đó và không bỏ sót dòng nào. Em hiểu không?","In my experience, I usually do the following. Open the document file, read each line and highlight it in blue or red. This is to make sure you have read that line and have not missed any lines. Do you understand?"
40,"Vâng, cách này tốt. Còn việc viết Q&A thì sao?","Yes, this way is good. What about writing Q&A?"
40,"Giả sử em đang đọc một dòng mà không hiểu, viết câu hỏi của em vào file Q&A. Sau đó, đừng dừng lại, đừng hỏi người khác viết thay, cứ tiếp tục đọc.","Suppose you are reading a line that you do not understand, write your Q&A in the Q&A file. Then, do not stop, do not ask someone else to write, just keep reading."
40,"Rất có khả năng là khi em đọc tới đoạn tiếp theo, em sẽ tự trả lời được hầu hết các câu hỏi Q&A mà em đã viết.","Most likely, by the time you read to the next paragraph, you will be able to answer most of the Q&A questions you wrote above."
40,"À, hiểu rồi. Tiếp đi, thú vị quá.","Oh, I see. Go on, it's so interesting."
40,"Phần còn lại đơn giản thôi, sau khi đọc đi đọc lại nhiều lần mà vẫn còn một số câu Q&A mà em không trả lời được, thì chỉ cần đem những câu đó đi hỏi người khác.","The rest is simple, after reading and re-reading many times and still having some Q&A questions that you can't answer yourself, you just take those questions to ask others."
40,"Nghe chị nói, em cảm thấy con đường phía trước đã sáng ra. Cảm ơn chị rất nhiều.","Listening to you, I feel like the path ahead is open. Thank you very much."
41,"Em buồn ngủ quá, Trung ơi. Từ sáng đến giờ em chưa làm được gì cả. Cảm giác như em không thể tập trung. Chị đã từng trải qua chuyện giống em chưa?","I'm so sleepy, Trung. I haven't done anything since this morning. It's like I can't concentrate. Have you ever experienced the same thing as me?"
41,"Em nghĩ chuyện đó bình thường quá. Chúng ta là con người, không phải robot có thể ngồi xuống và làm việc suốt. Em có nghe về nguyên tắc 80-20 chưa?","I thought that kind of thing is too normal. We are human, not robots that can just sit down and work. Haven't you heard of the 80-20 principle?"
41,"Chưa, hãy dạy em nguyên tắc đó đi.","No, please teach me that principle."
