lesson,vi,en
3,"Anh ơi, cho em nhận laptop ạ","Brother let me get the laptop"
3,"Cho anh xin họ tên và bộ phận của em","Can I have your name and department name"
3,"Nguyen Van Long, bộ phận MC2","Nguyen Van Long from department MC2"
3,"OK, em ngồi đây và cài giúp anh các phần mềm cần thiết để làm việc nhé","OK sit here and help me install the necessary software to work"
3,"Oh, anh ơi, mấy phần mềm này em không thấy file crack ạ","Oh bro I don't see any crack files for the software"
3,"Tội quá em ơi, đi làm rồi mà còn dùng crack file gì nữa, Công ty mua bản quyền cho các phần mềm hết rồi. Để anh đưa key cho em","Are you kidding me? You started working but still using cracked files? The company has already bought the license for all the software. Let me give you the key"
3,"Dạ, em nhà quê ghê, cảm ơn anh nhiều nhé","I see thank you"
3,"Dạ, em nhà quê ghê, cảm ơn anh nhiều nhé","I am truly a person of the last century thank you"
3,"Dạ, em nhà quê ghê, cảm ơn anh nhiều nhé","I must come from the Stone Age thank you"
4,"Em đi ăn trưa chưa, đi ăn với chị nhé","Have you had the lunch yet? Would you like to have lunch with me"
4,"Dạ vậy thì tốt quá ạ","Yes that's great"
4,"Em muốn ăn cơm hay món gì khác ngoài cơm ra","Do you want to eat rice or something else ?"
4,"Có món gì lạ thì giới thiệu cho em với","If there is anything strange, please introduce it to me"
4,"Chị thấy món cao lầu ở đây cũng OK, em ăn thử nhé","I think the Cao Lau dish here is OK, you should try it"
4,"Ngon quá chị ơi, em không ngờ đồ ăn ở căn tin mà ngon vậy","It's so delicious, I didn't expect the food in the canteen to be so delicious"
4,"Giá cũng mềm lắm em, giá này đã được công ty trợ giá rồi đáy","The price is also very cheap, on 20 thousand VND. This price has been subsidized by the company"
4,"Chị có thể giới thiệu một số thông tin cho em được không?","Can you give me some information about the company"
4,"Em cần biết thông tin gì?","What information do you need to know?"
4,"Chị nói về lương thưởng trước đi chị","Talk about the salary first"
4,"Công ty sẽ đánh giá performance của em 6 tháng 1 lần, đó sẽ xét tăng lương cũng 6 tháng 1 lần luôn","The company will evaluate your performance every 6 months. Then it will consider a salary increase every 6 months"
4,"Có khi nào công ty giảm lương của nhân viên không chị","Has the company ever reduced employee salaries?"
4,"Làm gì có chuyện đó em","No way"
4,"Muốn lên PM thì phải làm sao chị","What should I do to become a PM?"
4,"Em cứ làm cho tốt công việc của dev, sau đó, nếu công ty thấy em có năng lực, công ty sẽ tạo điều kiện cho em thôi","Just do your dev job well, then if the company sees that you are capable, they will create conditions for you"
5,"Hôm nay tôi sẽ giới thiệu tất cả thông tin về dự án cho bạn","Today I will introduce all the project information to you."
5,"Dự án của chúng tôi là một dự án thuê ngoài, làm việc với khách hàng Mỹ, về phần mềm quản lý cho hệ thống các phòng khám Đông y tại Mỹ.","Our project is an outsouring project, working with an American client, on a management software for a system of Oriental Medicine Clinics in the US"
5,"Dự án bắt đầu vào tháng 3 năm ngoái và dự kiến hoàn thành vào tháng 12 năm nay","The project started in March last year and is expected to be completed in December this year."
5,"Dự án có 15 người, bao gồm 1 PM, 2 lập trình viên full stack, 2 tester, 3 lập trình viên front end, 6 lập trình viên back end và 1 BA","The project has 15 people, including 1 pm, 2 full stack devs, 2 testers, 3 front end devs, 6 back end devs and 1 BA."
5,"Dự án dự kiến hoàn thành vào tháng 12 năm nay","The project is expected to be completed in December this year."
5,"Bạn sẽ thử việc trong 2 tháng với vai trò full stack dev. Sau 2 tháng, nếu được đánh giá OK, bạn sẽ trở thành nhân viên chính thức trong dự án này","You will be on probation for 2 months as a full stack dev. After 2 months, if you are rated OK, you will be an official employee in this project."
5,"Bạn có câu hỏi nào dành cho tôi không?","Do you have any questions for me?"
5,"Tôi có 2 câu hỏi. Thứ nhất, outsourcing nghĩa là gì? hứ hai, tôi có nhận được hướng dẫn hoặc hỗ trợ từ ai đó trong thời gian thử việc không?","I have 2 questions. First, what does outsourcing mean? Second, will I get any guidance or support from someone during the probationary period?"
5,"Ông Tam và cô Tân sẽ là những người trực tiếp hỗ trợ bạn. Nếu bạn có vấn đề gì, cứ hỏi họ","Mr. Tam and Ms. Tan will be the ones to directly support you. If you have any problems, just ask them."
5,"Và từ outsourcing nghĩa là thuê ngoài phần mềm. Điều đó có nghĩa là chúng tôi chỉ thực hiện một phần của dự án, không phải tất cả các giai đoạn của dự án phần mềm","And the word outsourcing means software outsourcing. That means we only do a part of a project, not all the stages of a software project."
6,"Cái hệ thống chúng ta đang làm có ba loại người dùng: quản lý, bác sĩ với khách hàng","The system we are working on has three types of users, namely manager, doctor and customer."
6,"Quản lý thì làm được mấy chức năng f1, f2 với f3","Managers can perform the functions f1, f2 and f3"
6,"Bác sĩ với khách hàng thì không coi được mấy loại báo cáo","Doctors and Customers cannot read types of reports"
6,"Quản lý có thể tạo tài khoản cho bác sĩ với khách hàng","Managers can create accounts belonging to doctor and customer"
6,"Tài khoản quản lý thì không bao giờ hết hạn, còn của bác sĩ với khách hàng thì có ngày hết hạn","Manager accounts do not expire while doctor and customer accounts have expiration dates"
6,"Muốn làm được chức năng f3 thì mình phải đi qua f1 rồi f2 trước","To perform function f3, we have to go through functions f1 and f2"
6,"Nếu mình không muốn bác sĩ thực hiện được chức năng f1 thì có thể dùng tài khoản quản lý để cấu hình quyền trên màn hình X","If we do not want a Doctor account to be able to perform function Fl, we can use the Manager account to configure the permission options on the screen X."
6,"Trên màn hình X, mình có thể xuất mấy file liên quan ra dạng excel","On the screen X, we can export related files in excel file format"
6,"Trên màn hình này mình cũng có thể up một file excel chứa thông tin XYZ vô hệ thống","On this screen, we can aslo upload an excel file containing XYZ information into the system"
6,"File excel dùng để nhập thông tin vô hệ thống phải có đủ các cột A, B, C","The excel file used to import information into the system must have columns A, B, C"
6,"Em không ngờ cái hệ thống này lại phức tạp dữ vậy","I didn't expect the system to be so complicated"
6,"Chắc em không nhớ hết trong 1 lúc thế này. Em phải coi lại rồi suy nghĩ từ từ","I can't remember everything at once. I have to review and think about it slowly."
7,"Nói chung, em đã nắm được cách vận hành của hệ thống. Nhưng về chi tiết, vẫn có một vài điểm em chưa hiểu đúng.","in general, you have grasped the systems operations. But in detail, there are a few points that you do not understand correctly."
7,"Long vẫn còn hơi ngại để hỏi. Chị đã ngồi chờ cả ngày xem liệu bạn có hỏi gì chị không, nhưng phải mất khá lâu em mới dám hỏi một câu.","long is still too shy to ask. I sat and waited all day to see if you would ask me anything, but it took a long time for me to be able to get a question from you."
7,"Em sợ làm phiền bạn nên em phải tự tìm hiểu. Em chỉ hỏi khi thực sự bị mắc kẹt. em sẽ rút kinh nghiệm từ trải nghiệm này ạ.","I was afraid of bothering you so I had to find out for myself. I only asked when I was really stuck. I will learn from my experience."
8,"Chú đã hoàn thành học kinh doanh rồi, giờ chú sẽ nghiên cứu cách lập trình cho hệ thống.","You have finished your business studies, now you will research how to code for the system"
8,"Trước mắt, chú hãy nghiên cứu mã nguồn này. Sau đó tạo một ứng dụng nhỏ, chỉ vài chức năng CRUD thôi. Rồi gửi cho anh xem lại.","For now, please study this source code. Then make a small app, just some CRUD functions. Then send it to me for review"
8,"Khi nào là hạn nộp ứng dụng này ạ?","When is the deadline to submit this app?"
8,"Anh cho chú ba ngày để hoàn thành.","I give you three days to complete it"
8,"Anh Trung ơi, giúp em với. Em không biết bắt đầu đọc mã nguồn từ đâu.","Trung, please help me with this. I don't know where to start reading this source code"
8,"Trước tiên, em phải chạy mã nguồn này đã. Sau đó chạy debug từng dòng để xem dòng nào chạy trước, dòng nào chạy sau.","First, you have to run this source code first. Then you should run debug line by line to see which line runs first, which line runs later."
8,"Nếu em debug từng dòng như vậy, em sợ sẽ quá nhiều. Em không dám debug đâu, anh ơi.","If I debug line by line like that, I'm afraid it's too much. I can't debug it, bro."
8,"Nếu vậy, em có thể đặt breakpoint ở đầu mỗi hàm. Sẽ dễ hơn để xem hàm nào được gọi trước, hàm nào được gọi sau.","If so, you can set breakpoints at the beginning of each function. It will be easier to see which function is called first and which function is called later."
8,"Ý tưởng tuyệt vời quá, anh ơi. Em không nghĩ ra được. Nếu em biết sớm, em đã hỏi anh từ trước rồi.","This is a great idea, bro. I couldn't think of it. If I had known I would have asked you earlier."
9,"Bây giờ em xin trình bày một app CRUD đơn giản mà em đã thử làm","Now I would like to present a simple CRUD app that I have tried"
9,"Để thêm khách hàng mới, thì nhấn nút tạo ở đây","To add a new customer, click the create button here"
9,"Để sửa thông tin khách hàng, ở màn hình danh sách khách hàng, nhấn nút cập nhật","To edit a customer, on the customer list screen, click the update button"
9,"Chức năng xóa cũng tương tự, mình sẽ dùng nút xóa ở màn hình danh sách","The delete function is similar, we will use the delete button on the list"
9,"Màn hình tạo mới và màn hình chỉnh sửa có giao diện giống nhau","The create screen and the edit screen have the same interfaces"
9,"Chỉ có vài cột bị disable ở màn hình edit, còn màn hình create thì không","Only some columns will be disabled in the edit screen, but not in the create screen"
9,"Hiện tại em chưa làm chức năng tìm kiếm và phân trang ở màn hình danh sách khách hàng, vì em không có đủ thời gian","I haven't done the search and pagination functions on the customer list screen yet, because I don't have enough time to do it"
9,"Khá ấn tượng đó! Mới có ba ngày mà em đã làm rất tốt rồi","Quite impressive! It's only been three days and you're doing very well"
9,"Chú ý đặt tên class và package nha. Hiện tại em chưa đặt theo convention của dự án đâu. Nhớ chú ý chỗ này","Pay attention to the class and package names. Currently, you have not named them according to the project convention. Remember to pay attention to that"
9,"Ngoài ra, sau khi kết nối database thì nhớ đóng connection lại. Đây là yêu cầu bắt buộc","Additionally, after connecting to the database, remember to close the connection. This is a mandatory requirement"
9,"Nếu quên đóng thì hậu quả khó lường lắm. Hệ thống có thể sinh ra lỗi khó hiểu","If you forget to close it, the consequences will be unpredictable. The system may generate incomprehensible errors"
9,"Bây giờ anh sẽ chỉ em cách push source code lên GitHub. Em có biết các branch của project mình đang làm không?","Now I will show you how to push source code to GitHub. Do you know the GitHub branches of the project we are working on?"
9,"Ngày xưa lúc còn sinh viên, em chỉ dùng mỗi main branch, tức là master branch. Cùng lắm thì em tạo thêm một branch ABC gì đó tự đặt tên thôi","When I was a student, I only used the main branch, that is, the master branch. At most, I used another ABC branch, which I named myself"
9,"Em cũng không rõ ngoài thực tế các branch được đặt tên như thế nào","I don't know how the branches are named in real projects"
9,"Project mình đang làm sẽ có mấy branch như sau. Đầu tiên là main branch, chứa source code để deploy lên production","The project we are working on will have the following branches. First is the main branch, containing source code to deploy to the production environment"
9,"Tiếp theo là staging branch, chứa source code để deploy lên môi trường test, tức là staging environment","Second is the staging branch, containing source code to deploy to the testing environment, i.e. the staging environment"
9,"Thứ ba là dev branch, chứa source code mà các dev merge lại với nhau sau khi code xong","Third is the dev branch, containing source code that the devs merge together after coding"
9,"Ngoài ra, mỗi dev có thể tạo branch riêng, nhưng cần đặt tên cẩn thận để tránh nhầm lẫn","In addition, each dev can create their own branches, but they need to name them carefully to avoid confusion"
9,"Và các dev phải thường xuyên kiểm tra, xóa các branch không cần thiết, để tránh tạo ra branch rác trên github","And the devs must regularly check and delete unnecessary branches, so as not to create junk branches on gethub"
9,"Khi merge code giữa các dev với nhau, có lỗi không anh? Nếu có thì phải làm sao?","When merging code between developers, will there be errors? What should we do when there are errors?"
9,"Tất nhiên là có lỗi rồi. Sau khi code xong, em sẽ phải push source code lên branch ABC","Of course there are some mistakes. After finishing the code, you will have to push the source code to the ABC branch"
9,"Sau đó em phải tạo pull request để team leader review code của em","Then, you have to create a pull request for the team leader to review your code"
9,"Nếu chưa rõ quy trình này thì em có thể xem thêm video trên YouTube. Người ta đã giải thích rất chi tiết","If you do not know this process clearly, you can watch more videos on YouTube. People have explained it in detail"
10,"Công việc của cậu thế nào, kể cho tớ nghe đi","how is your job tell me about it"
10,"Ừ, tớ nghe nói công việc cậu làm tốt lắm phải không?","okay I heard your work is good right"
10,"Ừm? Không, mới bắt đầu thôi, mọi thứ đều mới. Tớ phải thử 200% khả năng của mình","okay? No, just started working everything is new I have to try 200% of my ability"
10,"Công ty mình là công ty sản phẩm. Cả công ty sống dựa vào chỉ một sản phẩm. Hầu hết mọi người đều làm trên cùng một công nghệ","Our company is a product company. The whole company lives on only one Product. Almost everyone works on the same technology"
10,"Vậy công ty cậu chắc phải có nhiều người giỏi lắm. Thường khi làm một công nghệ, họ sẽ chuyên sâu vào công nghệ đó đúng không?","so your company must have many talented people. Usually when working on a technology, they will specialize in that technology, right?"
10,"Đúng rồi. Tớ thấy các anh chị senior rất giỏi. Họ biết mọi thứ rất rõ","that's right. I think the seniors are really good. they know everything very well"
10,"Team của tớ cũng ổn. Vì công ty mình là công ty outsourcing, họ biết nhiều công nghệ. Nhưng tớ thấy mọi người không chuyên sâu vào một thứ. Họ biết nhiều thứ, nhưng chỉ biết một chút về mỗi thứ","our team is also okay. because our company is an outsourcing company, they know a lot of technology. But I see that everyone is not specialized in one thing. it's like they know a lot of things, but only a little bit of each thing"
11,"Hôm nay chúng ta sẽ có cuộc họp sprint plan cho sprint tiếp theo. Product owner giao cho chúng ta 20 user story cho sprint mới này","Today we will have a sprint plan meeting for the next sprint. The product owner gave us 20 user stories for this new sprint"
11,"Trước tiên là estimate cho user story A. Mọi người cho ý kiến xem user story này có bao nhiêu story point","First is the estimate for user story A. Everyone please give your opinion on how many story points this user story has"
11,"Tớ nghĩ là 5 story point. Theo kinh nghiệm của tớ vậy","I think it's 5 story points. That's my experience"
11,"Tớ nghĩ là 7 hoặc 8 point bro. Tớ không nghĩ nó đơn giản vậy đâu bro","I think it's 7 or 8 points bro. I don't think it's that simple bro"
11,"Tớ thấy cái này dễ mà. Đừng nghĩ quá phức tạp. Tớ đã làm những chức năng tương tự rồi. Theo tớ, 3 story point là đủ","I think this is easy. Don't think it's too complicated. I've done similar functions before. In my opinion, 3 story points is enough"
11,"Sau khi mọi người thảo luận, tớ nghĩ hợp lý là cho user story A khoảng 5 point. Vậy hãy cho 5 point","After everyone discussed, I think it's reasonable to give this user story A about 5 points. So let's give it 5 points"
11,"Estimate xong rồi, bây giờ mọi người pick task nhé","Estimate done, now everyone pick up the tasks please"
11,"Tớ tình nguyện làm user story A","I volunteer to do user story A"
11,"Tớ chọn user story B","I choose user story B"
11,"Vậy tớ sẽ làm user story C","So I will do user story C"
11,"Long làm task D nhé. Task đó chắc trong khả năng của cậu","Long, do task D. That task is probably within your ability"
12,"Chị ơi, chị xác nhận giúp em yêu cầu của màn hình này với ạ","Sister, please confirm the requirements of this screen"
12,"Ừ, em cứ nói đi","Yes, go ahead"
12,"Tại sao mình phải cập nhật item A trước rồi mới được cập nhật item B ạ?","Why do we have to update item A first before we can update item B?"
12,"Phần này hơi dài dòng. Làm sao chị giải thích cho dễ hiểu đây nhỉ? Thôi, em ghi câu hỏi vào file Q&A đi. Ghi hết câu hỏi vào đó. Chị sẽ trả lời sau, giờ chị phải đi họp. Chị tưởng em hỏi mấy câu đơn giản thì chị trả lời ngay được. Nhưng mấy câu kiểu này thì cần thời gian để giải thích cho em","This part is a bit long-winded. How can I explain it in a way that is easy to understand? OK, write your questions in the Q&A file. Write all the questions there. I will answer them later. I have to go to a meeting now. I thought you would ask simple questions and I can answer them right away. Questions like this require time to explain to you"
12,"Long này, có vài câu em hỏi chị cũng không trả lời được. Chị sẽ hỏi product owner rồi trả lời lại cho em sau nhé","Long, there are some questions you ask that I can't answer. I will ask the product owner those questions and then answer you later"
12,"Vâng, chị nhớ hỏi product owner sớm giúp em nha","Yes, please ask product owner soon"
12,"Với lại em xem lại cách viết Q&A của em nhé. Có vài câu em diễn đạt khó hiểu quá. Chị phải đọc đi đọc lại mới hiểu được","And please review the way you write Q&A. There are some sentences you express that are too difficult to understand. I had to read them over and over again to understand"
12,"Dạ, đây là lần đầu tiên em làm. Chị chỉ em cách viết với ạ","Yes, this is my first time. Please teach me how to write"
12,"Em cứ tưởng tượng là mình đang viết cho một người không biết gì về công nghệ thông tin. Hoặc tưởng tượng viết cho học sinh cấp 2 vậy. Thì sẽ dễ hiểu hơn","Just imagine you are writing for someone who knows nothing about information technology. Or imagine you are writing for a middle school student. Then it will be easy to understand"
13,"Long, chị nói cái này","Long, I say this"
13,"Dạ, em tới ngay đây ạ","Yes, I'm coming right away"
13,"Sao em lại dùng file user story cũ vậy? Chị đọc Q&A em viết và phát hiện ra các câu hỏi em hỏi liên quan tới file user story cũ rồi","Why are you using the old user story file? I read the Q&A you wrote and found out that the questions you asked were related to the old user story file"
13,"Thật vậy ạ? Chị chỉ giúp em file mới được không?","Really? Can you show me the latest file?"
13,"Chị đã để file mới trong thư mục này rồi. Lần sau nhớ vào đây mà lấy. Hôm trước chị training cũng nhắc em rồi mà em không để ý","I left the latest file in this folder. Next time, remember to come here and get it. I reminded you about it when I trained you the other day, but you didn't pay attention"
13,"Em xin lỗi chị ạ","I'm sorry, sister"
13,"Long ơi, em có đó không? Sao em không tham gia họp dự án?","Are you here, Long? Why didn't you attend the project meeting?"
13,"Ủa, có họp à anh, em không thấy meeting request gì hết?","Oh, there is a meeting? I didn't see any meeting request."
13,"Anh đã gửi meeting request trước 1 tiếng rồi. Lần sau em phải chú ý. Cuộc họp này khá quan trọng đó. Nhớ đọc lại biên bản họp để nắm nội dung","I sent the meeting request an hour ago. You have to pay attention next time. This meeting is quite important. Remember to read the meeting minutes to know the content of the meeting"
13,"Vâng, hôm nay em may mắn ghê, buổi chiều bị cả hai anh chị la luôn","Yes, I got lucky this afternoon, got complained by two of you"
14,"Chị Thanh ơi, chiều nay anh Tuấn nhờ em viết biên bản họp. Em chưa bao giờ viết cái này cả. Chị hướng dẫn em với","Ms Thanh, this afternoon Mr. Tuan asked me to write meeting minutes for the meeting. I have never written this before. Please guide me"
14,"Em chưa bao giờ viết cái này cả. Chị chỉ em với","I have never written this before. Please guide me"
14,"À, chị cũng viết nhiều rồi. Đây có sẵn một template, để chị chỉ em","Oh, I also write a lot. Here is a ready-made template, let me show you"
14,"Phần thông tin chung sẽ gồm tên cuộc họp, ghi rõ tên cuộc họp, ví dụ: họp briefing, họp tổng kết dự án","The general information section will include meeting name, clearly state the name of the meeting, e.g., briefing meeting, project summary meeting"
14,"Thời gian, ghi rõ ngày, giờ bắt đầu và giờ kết thúc của cuộc họp","Time, clearly state the date, start and end time of the meeting"
14,"Địa điểm, ghi rõ địa điểm cuộc họp, ví dụ: phòng họp A, online qua Zoom","Location, clearly state the location of the meeting, e.g., meeting room A, online via Zoom"
14,"Thành phần tham dự, liệt kê những người tham gia cuộc họp (có thể kèm chức danh)","Participants, list the meeting participants (may include their titles)"
14,"Vắng mặt, liệt kê những người vắng mặt (nếu có) và lý do vắng mặt","Absences, list the absentees, if any, and the reason for their absence"
14,"Phần nội dung cuộc họp sẽ gồm tóm tắt nội dung, nêu ngắn gọn mục đích và các vấn đề chính được thảo luận","Meeting content section will include summary of content, briefly state the purpose and main issues discussed in the meeting"
14,"Diễn biến cuộc họp, trình bày chi tiết các nội dung đã thảo luận theo thứ tự thời gian, ghi lại các ý kiến đóng góp và thảo luận của các thành viên","Meeting progress, present details of the discussed contents in chronological order, record the contributions and discussions of the members"
14,"Quyết định và kết luận, ghi lại các quyết định đã thông qua và kết luận cuối cùng của cuộc họp","Decisions and conclusions, record the decisions past and the final conclusions of the meeting"
14,"Phần phân công công việc sẽ gồm các task cần thực hiện, liệt kê các công việc cần làm sau cuộc họp","Job assignment section will include tasks to be performed, list the tasks to be performed after the meeting"
14,"Người thực hiện, ghi rõ ai được giao nhiệm vụ","Who is performing the task, clearly state the person assigned to perform the task"
14,"Deadline, ghi rõ thời hạn hoàn thành công việc","Deadline, clearly state the deadline for completing the task"
